{"$schema":"https://json-schema.org/draft/2020-12/schema","$id":"https://fz-performance.local/schemas/event-objective.schema.json","title":"FZ Event Objective Registry","type":"object","required":["version","capabilities","events","evergreenObjectives"],"properties":{"version":{"const":"1.0"},"asOf":{"type":"string","format":"date"},"capabilities":{"type":"array","items":{"$ref":"#/$defs/capability"}},"events":{"type":"array","items":{"$ref":"#/$defs/event"}},"evergreenObjectives":{"type":"array","items":{"$ref":"#/$defs/evergreen"}}},"$defs":{"capability":{"type":"object","required":["id","name","category","description"],"properties":{"id":{"type":"string","pattern":"^[a-z0-9_]+$"},"name":{"type":"string"},"category":{"type":"string"},"description":{"type":"string"}},"additionalProperties":false},"demand":{"type":"object","required":["capabilityId","weight","transferWeight","specificity"],"properties":{"capabilityId":{"type":"string"},"weight":{"type":"number","minimum":0,"maximum":1},"transferWeight":{"type":"number","minimum":0,"maximum":1},"specificity":{"enum":["SHARED","EVENT_SPECIFIC","SUPPORT"]}},"additionalProperties":false},"event":{"type":"object","required":["id","name","status","role","strategicWeight","objective","demands"],"properties":{"id":{"type":"string"},"name":{"type":"string"},"date":{"type":["string","null"],"format":"date"},"status":{"enum":["DORMANT","SCHEDULED","ACTIVE","COMPLETED","CANCELLED"]},"role":{"enum":["PRIMARY","SECONDARY","VALIDATION","UNCLASSIFIED"]},"strategicWeight":{"type":"number","minimum":0,"maximum":1},"objective":{"type":"object"},"benchmark":{"type":"object"},"demands":{"type":"array","items":{"$ref":"#/$defs/demand"}},"formatProfileId":{"type":["string","null"]},"scheduleEvidence":{"type":"object"},"transferPolicy":{"type":"string"},"startsOn":{"type":["string","null"],"format":"date"},"endsOn":{"type":["string","null"],"format":"date"},"datePrecision":{"enum":["EXACT","DAY_RANGE","WEEK","MONTH","APPROXIMATE","UNKNOWN"]},"participationStatus":{"enum":["CONSIDERING","PLANNED","ENTERED","CONFIRMED","WITHDRAWN","UNKNOWN"]},"knowledgeStatus":{"enum":["RESEARCH_REQUIRED","ATHLETE_STRUCTURE_REQUIRED","QUALIFIED","PROVISIONAL"]}},"additionalProperties":false},"evergreen":{"type":"object","required":["id","name","status","role","strategicWeight","activationPolicy","description"],"properties":{"id":{"type":"string"},"name":{"type":"string"},"status":{"enum":["DORMANT","ACTIVE","COMPLETED","CANCELLED"]},"role":{"const":"MAINTENANCE"},"strategicWeight":{"type":"number","minimum":0,"maximum":1},"activationPolicy":{"type":"string"},"description":{"type":"string"}},"additionalProperties":false}},"additionalProperties":false}